{
  "terrain_id": "terrain_00007",
  "version": "1.0",
  "seed": 86420,
  "generated_at": "2026-05-21T11:44:33+00:00",
  "size_m": [
    50.0,
    50.0
  ],
  "resolution_m": 0.05,
  "origin": {
    "x": -25.0,
    "y": -25.0
  },
  "generation_params": {
    "terrain": {
      "method": "base_relief+craters+hills+ridges",
      "crater_count": 8,
      "hill_count": 5,
      "ridge_count": 3
    },
    "rocks": {
      "count": 80,
      "size_range_m": [
        0.3,
        1.0
      ],
      "min_spacing_m": 1.0,
      "slope_threshold_deg": 25.0,
      "asset_pool": [
        "rock_default"
      ]
    },
    "minerals": {
      "count": 12,
      "min_spacing_m": 3.0,
      "exclude_basecamp_radius_m": 6.0,
      "value_distribution": {
        "blue": {
          "prob": 0.5,
          "score": 10
        },
        "red": {
          "prob": 0.3,
          "score": 25
        },
        "yellow": {
          "prob": 0.2,
          "score": 50
        }
      }
    }
  },
  "spawn_locations": [
    {
      "x": -1.14,
      "y": -9.95,
      "z": 0.53,
      "yaw": 0.812,
      "group": "default"
    },
    {
      "x": -20.08,
      "y": 15.6,
      "z": 0.01,
      "yaw": 2.634,
      "group": "default"
    },
    {
      "x": 11.65,
      "y": 3.73,
      "z": 0.47,
      "yaw": 3.482,
      "group": "default"
    },
    {
      "x": 5.54,
      "y": 20.64,
      "z": 0.33,
      "yaw": 1.215,
      "group": "default"
    },
    {
      "x": 12.8,
      "y": -18.26,
      "z": -0.13,
      "yaw": 3.799,
      "group": "default"
    },
    {
      "x": -7.58,
      "y": 9.8,
      "z": 0.25,
      "yaw": 6.015,
      "group": "default"
    },
    {
      "x": 10.34,
      "y": 11.87,
      "z": 0.21,
      "yaw": 4.484,
      "group": "default"
    },
    {
      "x": -17.77,
      "y": -13.96,
      "z": 0.27,
      "yaw": 0.988,
      "group": "default"
    },
    {
      "x": -8.17,
      "y": -20.91,
      "z": -0.32,
      "yaw": 1.252,
      "group": "default"
    },
    {
      "x": -19.51,
      "y": 9.63,
      "z": 0.4,
      "yaw": 4.838,
      "group": "default"
    },
    {
      "x": 14.53,
      "y": -11.9,
      "z": 0.5,
      "yaw": 0.925,
      "group": "default"
    },
    {
      "x": -2.26,
      "y": 16.82,
      "z": 1.03,
      "yaw": 0.553,
      "group": "default"
    },
    {
      "x": 12.45,
      "y": -3.2,
      "z": 0.7,
      "yaw": 3.757,
      "group": "default"
    },
    {
      "x": 9.38,
      "y": 15.35,
      "z": 0.23,
      "yaw": 0.946,
      "group": "default"
    },
    {
      "x": -8.84,
      "y": -3.63,
      "z": 0.36,
      "yaw": 2.962,
      "group": "default"
    },
    {
      "x": 18.61,
      "y": -8.75,
      "z": 1.08,
      "yaw": 4.636,
      "group": "default"
    },
    {
      "x": -4.7,
      "y": 10.96,
      "z": 0.62,
      "yaw": 3.256,
      "group": "default"
    },
    {
      "x": -7.72,
      "y": 5.22,
      "z": 0.73,
      "yaw": 0.41,
      "group": "default"
    },
    {
      "x": 12.71,
      "y": 2.59,
      "z": 0.39,
      "yaw": 3.542,
      "group": "default"
    },
    {
      "x": 5.72,
      "y": -11.34,
      "z": 0.41,
      "yaw": 1.871,
      "group": "default"
    },
    {
      "x": -1.63,
      "y": -19.36,
      "z": 0.02,
      "yaw": 4.557,
      "group": "default"
    },
    {
      "x": 7.14,
      "y": -8.13,
      "z": 0.45,
      "yaw": 0.666,
      "group": "default"
    },
    {
      "x": -11.49,
      "y": 6.34,
      "z": 0.58,
      "yaw": 0.866,
      "group": "default"
    },
    {
      "x": 20.99,
      "y": -16.35,
      "z": 0.37,
      "yaw": 0.606,
      "group": "default"
    },
    {
      "x": 15.75,
      "y": -12.97,
      "z": 0.41,
      "yaw": 2.058,
      "group": "default"
    },
    {
      "x": 6.94,
      "y": -22.63,
      "z": -0.13,
      "yaw": 5.732,
      "group": "default"
    },
    {
      "x": -2.45,
      "y": 10.15,
      "z": 0.31,
      "yaw": 0.412,
      "group": "default"
    },
    {
      "x": 6.34,
      "y": -5.72,
      "z": 0.39,
      "yaw": 4.507,
      "group": "default"
    },
    {
      "x": -9.19,
      "y": 13.79,
      "z": 0.41,
      "yaw": 0.127,
      "group": "default"
    },
    {
      "x": -5.63,
      "y": 17.19,
      "z": 1.26,
      "yaw": 6.227,
      "group": "default"
    },
    {
      "x": 9.9,
      "y": 6.48,
      "z": 0.3,
      "yaw": 0.575,
      "group": "default"
    },
    {
      "x": -12.68,
      "y": 15.88,
      "z": -0.26,
      "yaw": 1.467,
      "group": "default"
    },
    {
      "x": -5.73,
      "y": -5.73,
      "z": 0.34,
      "yaw": 4.317,
      "group": "default"
    },
    {
      "x": 19.34,
      "y": -18.45,
      "z": 0.11,
      "yaw": 4.177,
      "group": "default"
    },
    {
      "x": 4.87,
      "y": 14.99,
      "z": -0.28,
      "yaw": 3.428,
      "group": "default"
    },
    {
      "x": 5.57,
      "y": -20.35,
      "z": 0.19,
      "yaw": 1.231,
      "group": "default"
    },
    {
      "x": 9.94,
      "y": 22.72,
      "z": -0.15,
      "yaw": 3.182,
      "group": "default"
    },
    {
      "x": 8.69,
      "y": -13.01,
      "z": 0.42,
      "yaw": 5.175,
      "group": "default"
    },
    {
      "x": -12.35,
      "y": 12.15,
      "z": 0.25,
      "yaw": 1.847,
      "group": "default"
    },
    {
      "x": -0.1,
      "y": 7.73,
      "z": 0.06,
      "yaw": 4.075,
      "group": "default"
    },
    {
      "x": 4.91,
      "y": -22.02,
      "z": -0.06,
      "yaw": 4.262,
      "group": "default"
    },
    {
      "x": 13.0,
      "y": -11.38,
      "z": 0.43,
      "yaw": 1.754,
      "group": "default"
    },
    {
      "x": 15.79,
      "y": 22.89,
      "z": 0.54,
      "yaw": 3.006,
      "group": "default"
    },
    {
      "x": -5.7,
      "y": 18.73,
      "z": 1.26,
      "yaw": 1.945,
      "group": "default"
    },
    {
      "x": -18.58,
      "y": -4.35,
      "z": 0.29,
      "yaw": 4.51,
      "group": "default"
    },
    {
      "x": -2.88,
      "y": -22.09,
      "z": -0.1,
      "yaw": 1.08,
      "group": "default"
    },
    {
      "x": 3.25,
      "y": 17.79,
      "z": 0.2,
      "yaw": 5.497,
      "group": "default"
    },
    {
      "x": 15.03,
      "y": 16.35,
      "z": 0.38,
      "yaw": 3.03,
      "group": "default"
    },
    {
      "x": -21.63,
      "y": -4.37,
      "z": 0.18,
      "yaw": 4.404,
      "group": "default"
    },
    {
      "x": -3.38,
      "y": -18.16,
      "z": -0.28,
      "yaw": 5.465,
      "group": "default"
    }
  ],
  "basecamp": {
    "center": {
      "x": 0.0,
      "y": 0.0
    },
    "radius": 6.0,
    "marker_usd": "basecamp_dome.usd",
    "visual_footprint_m": [
      8.0,
      8.0
    ],
    "marker_height_m": 5.5,
    "shape": null,
    "entry_points": [],
    "collision_usd_path": null
  },
  "minerals": [
    {
      "id": 1,
      "type": "red",
      "position": {
        "x": -9.75,
        "y": 16.88,
        "z": 0.59
      },
      "value": 25
    },
    {
      "id": 2,
      "type": "red",
      "position": {
        "x": 1.23,
        "y": -19.85,
        "z": 0.06
      },
      "value": 25
    },
    {
      "id": 3,
      "type": "blue",
      "position": {
        "x": 4.56,
        "y": -8.43,
        "z": 0.2
      },
      "value": 10
    },
    {
      "id": 4,
      "type": "yellow",
      "position": {
        "x": -6.54,
        "y": -4.82,
        "z": 0.28
      },
      "value": 50
    },
    {
      "id": 5,
      "type": "blue",
      "position": {
        "x": 16.12,
        "y": 21.21,
        "z": 0.48
      },
      "value": 10
    },
    {
      "id": 6,
      "type": "blue",
      "position": {
        "x": 17.63,
        "y": -16.46,
        "z": 0.06
      },
      "value": 10
    },
    {
      "id": 7,
      "type": "blue",
      "position": {
        "x": -17.91,
        "y": -19.66,
        "z": 0.38
      },
      "value": 10
    },
    {
      "id": 8,
      "type": "red",
      "position": {
        "x": -16.34,
        "y": 19.12,
        "z": -0.59
      },
      "value": 25
    },
    {
      "id": 9,
      "type": "red",
      "position": {
        "x": -0.07,
        "y": 7.31,
        "z": 0.04
      },
      "value": 25
    },
    {
      "id": 10,
      "type": "red",
      "position": {
        "x": -1.81,
        "y": -19.52,
        "z": -0.09
      },
      "value": 25
    },
    {
      "id": 11,
      "type": "yellow",
      "position": {
        "x": -5.11,
        "y": -17.93,
        "z": -0.26
      },
      "value": 50
    },
    {
      "id": 12,
      "type": "blue",
      "position": {
        "x": -6.04,
        "y": 11.21,
        "z": 0.44
      },
      "value": 10
    }
  ],
  "physics_zones": [
    {
      "type": "sand",
      "polygon": [
        [
          -10,
          -10
        ],
        [
          10,
          -10
        ],
        [
          10,
          0
        ],
        [
          -10,
          0
        ]
      ],
      "static_friction": 0.3,
      "dynamic_friction": 0.25
    },
    {
      "type": "rocky",
      "polygon": [
        [
          -25,
          -25
        ],
        [
          -10,
          -25
        ],
        [
          -10,
          -10
        ],
        [
          -25,
          -10
        ]
      ],
      "static_friction": 0.55,
      "dynamic_friction": 0.5
    }
  ],
  "minimap": {
    "grid_size": [
      25,
      25
    ],
    "cell_size_m": 2.0,
    "origin": {
      "x": -25.0,
      "y": -25.0
    }
  },
  "difficulty": {
    "score": 0.453,
    "rock_density": 0.032,
    "max_slope_deg": 37.6,
    "mean_slope_deg": 8.11,
    "passable_ratio": 0.919,
    "longest_corridor_m": 47.28
  }
}